{
  "$schema": "https://json-schema.org/draft/2020-12/schema",
  "title": "Browser Agent Eval Cases",
  "type": "array",
  "items": {
    "type": "object",
    "required": ["id", "domain", "start_url", "task", "expected"],
    "additionalProperties": false,
    "properties": {
      "id": {"type": "string", "minLength": 1},
      "domain": {"type": "string", "minLength": 1},
      "start_url": {"type": "string", "minLength": 1},
      "task": {"type": "string", "minLength": 1},
      "expected_status": {"type": "string"},
      "max_steps": {"type": "integer", "minimum": 1},
      "tags": {"type": "array", "items": {"type": "string"}},
      "reference_path": {"type": "array", "items": {"type": "string"}},
      "expected": {
        "type": "array",
        "minItems": 1,
        "items": {
          "type": "object",
          "required": ["type", "target", "value"],
          "additionalProperties": false,
          "properties": {
            "type": {"type": "string"},
            "target": {"type": "string"},
            "value": {}
          }
        }
      }
    }
  }
}
